{
  "auditType": "static",
  "status": "pass",
  "startedAt": "2026-04-06T20:52:23.799Z",
  "completedAt": "2026-04-06T20:52:23.799Z",
  "durationMs": 0,
  "summary": {
    "pass": 9,
    "warn": 0,
    "fail": 0,
    "critical": 0
  },
  "checks": [
    {
      "name": "workspace_boundary",
      "status": "pass",
      "details": "No workspace boundary violations detected",
      "durationMs": 141
    },
    {
      "name": "forbidden_signing_calls",
      "status": "pass",
      "details": "No forbidden signing patterns found in worker code",
      "durationMs": 342
    },
    {
      "name": "forbidden_broadcast_calls",
      "status": "pass",
      "details": "No forbidden broadcast patterns found in worker code",
      "durationMs": 103
    },
    {
      "name": "env_contracts",
      "status": "pass",
      "details": "All environment contract addresses match canonical values",
      "durationMs": 0
    },
    {
      "name": "required_files",
      "status": "pass",
      "details": "All required files present",
      "durationMs": 0
    },
    {
      "name": "config_env_required",
      "status": "pass",
      "details": "All required environment variables present",
      "durationMs": 0
    },
    {
      "name": "config_file_exists",
      "status": "pass",
      "details": "agent/config.js exists",
      "durationMs": 0
    },
    {
      "name": "unsigned_handoff_only",
      "status": "pass",
      "details": "No signing logic found in worker code — unsigned handoff doctrine upheld",
      "durationMs": 25
    },
    {
      "name": "no_private_key_usage",
      "status": "pass",
      "details": "No private key references found in worker code",
      "durationMs": 52
    }
  ],
  "metrics": {
    "durationMs": 0
  }
}